{
  "suite": "framework-dotnet-evals",
  "description": "Co-located evaluation tests for .NET framework profile trigger resolution",
  "version": "1.0.0",
  "test_cases": [
    {
      "id": "EVAL-FW-DOTNET-COLOCATED-001",
      "name": "ASP.NET Core & EF Core Profile Trigger",
      "target_skill": "framework-dotnet",
      "prompt": "Implement an ASP.NET Core Minimal API with EF Core in the adapter and a MediatR-style handler, covered by xUnit WebApplicationFactory tests.",
      "context": {
        "detected_stack": [
          ".NET",
          "C#"
        ]
      },
      "assertions": {
        "required_triggers": [
          "dotnet",
          "aspnetcore",
          "ef core",
          "mediatr",
          "xunit",
          "webapplicationfactory"
        ],
        "required_patterns": [
          "handler",
          "adapter"
        ],
        "forbidden_patterns": [
          "ASCII art"
        ],
        "required_output_sections": [
          "Handler",
          "EF Core Adapter"
        ]
      }
    }
  ]
}
