{
  "suite": "agent-user-stories-co-located",
  "description": "Co-located evaluation for Linear INVEST user stories with AC and Mermaid wireframes",
  "version": "1.0.0",
  "test_cases": [
    {
      "id": "EVAL-USERSTORIES-COLOCATED-001",
      "name": "Linear INVEST story with wireframe",
      "description": "Ensures UI backlog tickets use persona/want/outcome, Given/When/Then criteria, and Mermaid - not code or ASCII art.",
      "target_skill": "agent-user-stories",
      "prompt": "Add Linear user stories with acceptance criteria and wireframes for the onboarding chooser ZIP scan.",
      "context": {
        "active_phase": "spec"
      },
      "assertions": {
        "required_triggers": [
          "linear",
          "user story",
          "acceptance criteria",
          "wireframe"
        ],
        "required_patterns": [
          "As a",
          "I want",
          "so that",
          "Given ",
          "When ",
          "Then "
        ],
        "forbidden_patterns": [
          "```typescript",
          "ASCII art",
          "box-drawing"
        ],
        "required_output_sections": [
          "Story",
          "Acceptance criteria",
          "Wireframe",
          "Out of scope"
        ]
      }
    },
    {
      "id": "EVAL-USERSTORIES-COLOCATED-002",
      "name": "Review Linear: operator stories without fake UI",
      "description": "Ensures a backlog review recasts CLI/on-call checklists as operator INVEST stories and does not require a Wireframe heading.",
      "target_skill": "agent-user-stories",
      "prompt": "Review my Linear tasks and rewrite the wk align checklist tickets as operator user stories with acceptance criteria.",
      "context": {
        "active_phase": "spec"
      },
      "assertions": {
        "required_triggers": [
          "linear",
          "review tickets",
          "operator story",
          "acceptance criteria"
        ],
        "required_patterns": [
          "As a",
          "I want",
          "so that",
          "Given ",
          "When ",
          "Then ",
          "Out of scope"
        ],
        "forbidden_patterns": [
          "```typescript",
          "ASCII art",
          "box-drawing",
          "As a customer"
        ],
        "required_output_sections": [
          "Story",
          "Acceptance criteria",
          "Out of scope"
        ]
      }
    },
    {
      "id": "EVAL-USERSTORIES-COLOCATED-003",
      "name": "File PostHog handover after restore default",
      "description": "Ensures filing a PostHog findings handover as Linear work uses product-signal-intake and existing story/PRD routing after restoring default, not a new specialist skill.",
      "target_skill": "agent-user-stories",
      "prompt": "File this PostHog handover as Linear user stories with acceptance criteria after restoring default MCP.",
      "context": {
        "active_phase": "spec"
      },
      "assertions": {
        "required_triggers": [
          "linear",
          "user stories",
          "acceptance criteria"
        ],
        "required_patterns": [
          "product-signal-intake",
          "wk mcp default"
        ],
        "forbidden_patterns": [
          "```typescript",
          "ASCII art",
          "box-drawing"
        ],
        "required_output_sections": [
          "product-signal-intake"
        ]
      }
    },
    {
      "id": "EVAL-USERSTORIES-COLOCATED-004",
      "name": "Missing Linear tools after restore drafts only",
      "description": "Ensures Session B of product-signal-intake stops without inventing Linear URLs when Linear tools are missing after wk mcp default.",
      "target_skill": "agent-user-stories",
      "prompt": "Restore default MCP, then file this confirmed PostHog handover row. Linear tools are still missing.",
      "context": {
        "active_phase": "spec"
      },
      "assertions": {
        "required_triggers": ["linear", "user stories"],
        "required_patterns": ["product-signal-intake", "wk mcp default"],
        "forbidden_patterns": ["```typescript", "ASCII art", "box-drawing"],
        "required_output_sections": ["product-signal-intake"]
      }
    }
  ]
}
