{
  "suite": "agent-xfn-co-located",
  "description": "Co-located evaluation benchmark for agent-xfn skill",
  "version": "1.0.0",
  "test_cases": [
    {
      "id": "EVAL-XFN-COLOCATED-001",
      "name": "Single Skill XFN Quality Verification",
      "description": "Ensures agent-xfn produces cross-functional quality matrices for browser E2E, accessibility, security, and load suites.",
      "target_skill": "agent-xfn",
      "prompt": "Design the XFN test plan for the workspace sharing modal.",
      "context": {
        "active_phase": "xfn"
      },
      "assertions": {
        "required_triggers": [
          "xfn matrix",
          "accessibility",
          "browser e2e"
        ],
        "required_patterns": [
          "Accessibility",
          "Security",
          "Performance",
          "SLO"
        ],
        "forbidden_patterns": [
          "ASCII art"
        ]
      }
    },
    {
      "id": "EVAL-XFN-COLOCATED-002",
      "name": "XFN is a separate child from TDD",
      "description": "Browser E2E and load apply rows run in an agent-xfn subagent; parent reads handover_xfn.md.",
      "target_skill": "agent-xfn",
      "prompt": "Green Playwright and load apply rows for the sharing modal without keeping that work on TDD.",
      "context": {
        "active_phase": "xfn"
      },
      "assertions": {
        "required_triggers": [
          "xfn",
          "playwright",
          "browser e2e"
        ],
        "required_patterns": [
          "subagent",
          "separate child",
          "handover_xfn.md"
        ],
        "forbidden_patterns": [
          "ASCII art"
        ]
      }
    }
  ]
}
